{
  "$schema": "http://json-schema.org/draft-07/schema#",
  "$id": "https://salvageunion.io/schema/abilities.schema.json",
  "title": "abilities",
  "description": "Pilot abilities and skills",
  "type": "array",
  "items": {
    "$schema": "http://json-schema.org/draft-07/schema#",
    "type": "object",
    "properties": {
      "hasArtwork": {
        "type": "boolean",
        "description": "Whether this entity has artwork; the .webp URL is derived from schema + slug"
      },
      "content": {
        "type": "array",
        "items": {
          "description": "Block of structured content for rendering (paragraph, heading, list item, etc.)",
          "type": "object",
          "properties": {
            "type": {
              "default": "paragraph",
              "type": "string",
              "enum": [
                "paragraph",
                "heading",
                "list-item",
                "label",
                "datavalues",
                "hint",
                "flavor",
                "choice"
              ],
              "description": "Type of content block for rendering structured text"
            },
            "value": {
              "anyOf": [
                { "type": "string" },
                {
                  "type": "array",
                  "items": {
                    "type": "object",
                    "properties": {
                      "label": {
                        "anyOf": [{ "type": "string" }, { "type": "number" }],
                        "description": "Display label for this data value"
                      },
                      "value": {
                        "anyOf": [{ "type": "string" }, { "type": "number" }],
                        "description": "The data value"
                      },
                      "type": {
                        "type": "string",
                        "enum": ["keyword", "trait", "cost"],
                        "description": "Type classification for this data value"
                      },
                      "unit": {
                        "type": "string",
                        "description": "Optional unit shown after the value (e.g. damage type \"SP\")"
                      },
                      "perTechLevel": {
                        "type": "number",
                        "description": "When set, this numeric value scales with the entity's effective tech level: it increases by this amount for each tech level above the first (e.g. Custom Sniper Rifle damage \"+1 SP per Tech Level after the first\")"
                      }
                    },
                    "required": ["label"],
                    "additionalProperties": false,
                    "description": "A data value with label, optional value, optional type, optional unit, and optional per-tech-level scaling"
                  },
                  "description": "Array of data values when type is 'datavalues'"
                }
              ]
            },
            "label": { "type": "string" },
            "level": { "type": "integer", "minimum": 1, "maximum": 6 },
            "lead": { "type": "boolean" },
            "choiceId": {
              "type": "string",
              "description": "When type is \"choice\": the id of the entity choice to render inline at this position"
            },
            "items": {
              "type": "array",
              "items": {
                "type": "object",
                "properties": {
                  "type": {
                    "default": "paragraph",
                    "type": "string",
                    "enum": [
                      "paragraph",
                      "heading",
                      "list-item",
                      "label",
                      "datavalues",
                      "hint",
                      "flavor",
                      "choice"
                    ],
                    "description": "Type of content block for rendering structured text"
                  },
                  "value": {
                    "anyOf": [
                      { "type": "string" },
                      {
                        "type": "array",
                        "items": {
                          "type": "object",
                          "properties": {
                            "label": {
                              "anyOf": [{ "type": "string" }, { "type": "number" }],
                              "description": "Display label for this data value"
                            },
                            "value": {
                              "anyOf": [{ "type": "string" }, { "type": "number" }],
                              "description": "The data value"
                            },
                            "type": {
                              "type": "string",
                              "enum": ["keyword", "trait", "cost"],
                              "description": "Type classification for this data value"
                            },
                            "unit": {
                              "type": "string",
                              "description": "Optional unit shown after the value (e.g. damage type \"SP\")"
                            },
                            "perTechLevel": {
                              "type": "number",
                              "description": "When set, this numeric value scales with the entity's effective tech level: it increases by this amount for each tech level above the first (e.g. Custom Sniper Rifle damage \"+1 SP per Tech Level after the first\")"
                            }
                          },
                          "required": ["label"],
                          "additionalProperties": false,
                          "description": "A data value with label, optional value, optional type, optional unit, and optional per-tech-level scaling"
                        },
                        "description": "Array of data values when type is 'datavalues'"
                      }
                    ]
                  },
                  "label": { "type": "string" },
                  "level": { "type": "integer", "minimum": 1, "maximum": 6 }
                },
                "required": ["type"],
                "additionalProperties": false
              }
            }
          },
          "required": ["type"],
          "additionalProperties": false
        },
        "description": "Descriptive content blocks for this entity"
      },
      "id": { "type": "string", "description": "Unique identifier for this entity" },
      "blackMarket": {
        "type": "boolean",
        "description": "Whether this entity is only available on the black market"
      },
      "name": { "type": "string", "minLength": 1, "description": "Display name of this entity" },
      "source": {
        "type": "string",
        "enum": [
          "Salvage Union Workshop Manual",
          "Salvage Union Starter Set",
          "Reclamation of the Wastes",
          "The Hive",
          "Thatcher's Mech Base",
          "Relics of a Time Gone By",
          "Mech Monday",
          "We Were Here First!",
          "Rainmaker",
          "False Flag"
        ],
        "description": "Primary source book this entity appears in"
      },
      "page": {
        "type": "integer",
        "exclusiveMinimum": 0,
        "maximum": 9007199254740991,
        "description": "Page number in the primary source book"
      },
      "booklet": {
        "type": "string",
        "minLength": 1,
        "description": "Booklet code within a multi-booklet primary source (e.g. \"CR\", \"PH\", \"PC\", \"RR\", \"AP\" for the Salvage Union Starter Set). Omit for single-volume sources."
      },
      "additionalSources": {
        "type": "array",
        "items": {
          "type": "object",
          "properties": {
            "source": {
              "type": "string",
              "enum": [
                "Salvage Union Workshop Manual",
                "Salvage Union Starter Set",
                "Reclamation of the Wastes",
                "The Hive",
                "Thatcher's Mech Base",
                "Relics of a Time Gone By",
                "Mech Monday",
                "We Were Here First!",
                "Rainmaker",
                "False Flag"
              ],
              "description": "Secondary source book this entity also appears in"
            },
            "booklet": {
              "type": "string",
              "minLength": 1,
              "description": "Booklet code within a multi-booklet source (e.g. \"CR\", \"PH\", \"PC\", \"RR\", \"AP\" for the Salvage Union Starter Set — Core Rulebook / Pilots Handbook / Parts Catalogue / Rules Reference / Asset Pack). Omit for single-volume sources."
            },
            "page": {
              "type": "integer",
              "exclusiveMinimum": 0,
              "maximum": 9007199254740991,
              "description": "Page number in the secondary source book"
            }
          },
          "required": ["source", "page"],
          "additionalProperties": false,
          "description": "A secondary source where this entity is reprinted (e.g. condensed in a Starter Set)"
        },
        "description": "Other source books where this entity is reprinted"
      },
      "description": { "type": "string", "description": "Short description of the ability" },
      "tree": {
        "type": "string",
        "enum": [
          "Advanced Engineer",
          "Advanced Hacking",
          "Advanced Hauler",
          "Advanced Scout",
          "Advanced Soldier",
          "Augmentation",
          "Cyborg",
          "Electronics",
          "Fabricator",
          "Forging",
          "Generic",
          "Gladiatorial Combat",
          "Hacking",
          "Leadership",
          "Legendary Cyborg",
          "Legendary Engineer",
          "Legendary Fabricator",
          "Legendary Hacker",
          "Legendary Hauler",
          "Legendary Ranger",
          "Legendary Scout",
          "Legendary Smuggler",
          "Legendary Soldier",
          "Legendary Union Rep",
          "Mech-Tech",
          "Mechanical Knowledge",
          "Ranger",
          "Recon",
          "Salvaging",
          "Sleuth",
          "Smuggler",
          "Sniper",
          "Survivalist",
          "Tactical Warfare",
          "Trading",
          "Union Rep"
        ],
        "description": "Ability tree this ability belongs to"
      },
      "level": {
        "anyOf": [
          { "type": "integer", "minimum": 1, "maximum": 3 },
          { "type": "string", "const": "L" },
          { "type": "string", "const": "G" }
        ],
        "description": "Ability level (1-3, L for Legendary, G for Generic)"
      },
      "mechActionType": {
        "type": "string",
        "enum": ["Passive", "Free", "Reaction", "Turn", "Short", "Long", "DownTime"],
        "description": "Action type when used as a mech action"
      },
      "grants": {
        "type": "array",
        "items": {
          "type": "object",
          "properties": {
            "schema": {
              "anyOf": [
                {
                  "type": "string",
                  "enum": [
                    "abilities",
                    "ability-tree-requirements",
                    "chassis",
                    "classes",
                    "crawler-bays",
                    "crawler-tech-levels",
                    "crawlers",
                    "creatures",
                    "distances",
                    "drones",
                    "equipment",
                    "guides",
                    "keywords",
                    "factions",
                    "meld",
                    "modules",
                    "npcs",
                    "roll-tables",
                    "sources",
                    "squads",
                    "tech-levels",
                    "systems",
                    "bio-titans",
                    "traits",
                    "vehicles"
                  ],
                  "description": "Name of the entity schema collection"
                },
                { "type": "string", "const": "choice" }
              ],
              "description": "Schema collection the granted entity belongs to, or 'choice' for a choice grant"
            },
            "name": {
              "type": "string",
              "minLength": 1,
              "description": "Name of the granted entity or choice"
            }
          },
          "required": ["schema", "name"],
          "additionalProperties": false,
          "description": "An entity or choice granted by an ability"
        },
        "description": "Entities or choices granted by this ability"
      },
      "activationCurrency": {
        "type": "string",
        "enum": ["Variable", "EP or AP", "SP or HP"],
        "description": "Currency type used for activation"
      },
      "actions": {
        "type": "array",
        "items": { "type": "string" },
        "description": "Action names this ability provides"
      },
      "contributions": {
        "type": "array",
        "items": {
          "type": "object",
          "properties": {
            "stat": {
              "type": "string",
              "enum": [
                "structurePoints",
                "energyPoints",
                "heatCapacity",
                "cargoCapacity",
                "systemSlots",
                "moduleSlots",
                "maxHp",
                "maxAp",
                "inventorySlots"
              ],
              "description": "The mech, pilot or slot-count stat a contribution raises or lowers"
            },
            "amount": {
              "anyOf": [
                { "type": "integer", "minimum": -9007199254740991, "maximum": 9007199254740991 },
                {
                  "type": "object",
                  "properties": {
                    "flat": {
                      "type": "integer",
                      "minimum": -9007199254740991,
                      "maximum": 9007199254740991,
                      "description": "The constant part"
                    },
                    "perTechLevel": {
                      "type": "integer",
                      "minimum": -9007199254740991,
                      "maximum": 9007199254740991,
                      "description": "Multiplied by the target's tech level"
                    }
                  },
                  "required": ["perTechLevel"],
                  "additionalProperties": false
                },
                {
                  "type": "object",
                  "properties": {
                    "fromStat": {
                      "type": "string",
                      "enum": [
                        "structurePoints",
                        "energyPoints",
                        "heatCapacity",
                        "cargoCapacity",
                        "systemSlots",
                        "moduleSlots",
                        "maxHp",
                        "maxAp",
                        "inventorySlots"
                      ],
                      "description": "The mech, pilot or slot-count stat a contribution raises or lowers"
                    }
                  },
                  "required": ["fromStat"],
                  "additionalProperties": false
                }
              ],
              "description": "How much a contribution is worth: a flat integer, a per-tech-level formula, or another of the target stats"
            },
            "target": {
              "type": "string",
              "enum": ["self", "pilot", "pilotedMech", "crawler"],
              "description": "Defaults to `self` when absent"
            },
            "stacks": {
              "type": "boolean",
              "description": "Applies once per installed copy (default true for installable items)"
            },
            "voidWhen": {
              "type": "string",
              "enum": ["damaged", "destroyed"],
              "description": "Condition at which this contribution stops applying"
            },
            "duration": {
              "type": "string",
              "enum": ["permanent", "activated"],
              "description": "Permanent (default) applies whenever held/installed. `activated` applies only while the player has switched it on in Guided Play — saved on the pilot's seat in the Game (ADR-038), never on the entity."
            },
            "note": { "type": "string", "description": "Why this is encoded the way it is" }
          },
          "required": ["stat", "amount"],
          "additionalProperties": false,
          "description": "A flat mechanical contribution this content makes to a stat"
        },
        "description": "Flat stat changes this ability makes (ADR-029), so a stated mechanical change (Beefcake, Bionic Arms) applies rather than staying inert prose."
      }
    },
    "required": ["id", "name", "source", "page", "tree", "level", "actions"],
    "additionalProperties": false,
    "description": "Pilot abilities and skills"
  }
}
