[
  {
    "id": "ef787157-c4d4-44bf-857f-71eec0db7939",
    "name": "Engineering Expertise",
    "source": "Salvage Union Workshop Manual",
    "tree": "Mechanical Knowledge",
    "level": 1,
    "page": 28,
    "actions": ["Engineering Expertise"],
    "description": "Ask questions pertaining to mechanical and engineering topics.",
    "additionalSources": [
      {
        "source": "Salvage Union Starter Set",
        "booklet": "PH",
        "page": 13
      }
    ]
  },
  {
    "id": "c3b7d2dd-d774-45b8-827c-48d3c9c58202",
    "name": "Talk Shop",
    "source": "Salvage Union Workshop Manual",
    "tree": "Mechanical Knowledge",
    "level": 2,
    "page": 28,
    "actions": ["Talk Shop"],
    "description": "Build rapport, and ask favours of other mechanics, salvagers, and workers.",
    "additionalSources": [
      {
        "source": "Salvage Union Starter Set",
        "booklet": "PH",
        "page": 13
      }
    ]
  },
  {
    "id": "fba6ecb0-86c6-4b4a-9daf-f0056c79c88f",
    "name": "Mech Acquisition",
    "source": "Salvage Union Workshop Manual",
    "tree": "Mechanical Knowledge",
    "level": 3,
    "page": 28,
    "description": "Track down and acquire specific Mech parts and Chassis.",
    "actions": ["Mech Acquisition"],
    "additionalSources": [
      {
        "source": "Salvage Union Starter Set",
        "booklet": "PH",
        "page": 13
      }
    ]
  },
  {
    "id": "5521c16b-0831-4a2e-87b5-0f9205b734da",
    "name": "Mass Field Maintenance",
    "source": "Salvage Union Workshop Manual",
    "tree": "Mech-Tech",
    "level": 1,
    "page": 29,
    "description": "Repair 4 SP on target Mechs or Vehicles in the field.",
    "actions": ["Mass Field Maintenance"],
    "additionalSources": [
      {
        "source": "Salvage Union Starter Set",
        "booklet": "PH",
        "page": 14
      }
    ]
  },
  {
    "id": "c28d466d-0a44-434e-8258-2f188285c67f",
    "name": "If I cut this wire...",
    "source": "Salvage Union Workshop Manual",
    "tree": "Mech-Tech",
    "level": 2,
    "page": 29,
    "actions": ["If I cut this wire..."],
    "description": "Damage Systems and Modules on target Mech.",
    "additionalSources": [
      {
        "source": "Salvage Union Starter Set",
        "booklet": "PH",
        "page": 14
      }
    ]
  },
  {
    "id": "8fff03d8-8831-4143-af99-b3439bf9a306",
    "name": "Mass Field Repair",
    "source": "Salvage Union Workshop Manual",
    "tree": "Mech-Tech",
    "level": 3,
    "page": 29,
    "actions": ["Mass Field Repair"],
    "description": "Repair target Systems and Modules in the field.",
    "additionalSources": [
      {
        "source": "Salvage Union Starter Set",
        "booklet": "PH",
        "page": 14
      }
    ]
  },
  {
    "id": "d51afc02-2683-46e1-acba-353d85eaf071",
    "name": "Jury Rig",
    "source": "Salvage Union Workshop Manual",
    "tree": "Forging",
    "level": 1,
    "page": 29,
    "actions": ["Jury Rig"],
    "description": "Craft improvised equipment from everyday items.",
    "additionalSources": [
      {
        "source": "Salvage Union Starter Set",
        "booklet": "PH",
        "page": 14
      }
    ]
  },
  {
    "id": "4c410720-0a21-4b2b-a842-68a4d34ccf33",
    "name": "Mech-Gyver",
    "source": "Salvage Union Workshop Manual",
    "tree": "Forging",
    "level": 2,
    "page": 29,
    "actions": ["Mech-Gyver"],
    "description": "Craft Mech Systems and Modules from Scrap in the field.",
    "additionalSources": [
      {
        "source": "Salvage Union Starter Set",
        "booklet": "PH",
        "page": 15
      }
    ]
  },
  {
    "id": "c7f121eb-6e9f-46e6-9500-f65860ddd08c",
    "name": "Auto-Turret",
    "source": "Salvage Union Workshop Manual",
    "tree": "Forging",
    "level": 3,
    "grants": [
      {
        "name": "Auto-Turret",
        "schema": "equipment"
      }
    ],
    "page": 29,
    "description": "Construct an Immobile Auto-Turret that can be fitted with Systems and Modules.",
    "actions": ["Auto-Turret"],
    "additionalSources": [
      {
        "source": "Salvage Union Starter Set",
        "booklet": "PH",
        "page": 15
      }
    ]
  },
  {
    "id": "8f954763-3014-4184-ace6-a7409ff00401",
    "name": "Union Engineer",
    "source": "Salvage Union Workshop Manual",
    "tree": "Advanced Engineer",
    "level": 1,
    "page": 30,
    "description": "Improved repair; gain an additional 4SP when using Repair abilities or Systems.",
    "content": [
      {
        "value": "You have specialised in getting your hands dirty, you can patch up even the most brutally damaged Mechs with ease, even in the midst of conflict.",
        "type": "paragraph"
      }
    ],
    "actions": ["Mender", "Quick Fix"]
  },
  {
    "id": "195fec1d-d749-4e5c-b7c1-f4986f14114f",
    "name": "This one goes to 11...",
    "source": "Salvage Union Workshop Manual",
    "tree": "Advanced Engineer",
    "level": 2,
    "page": 30,
    "description": "Overcharge a Reactor beyond its initial capacity to gain additional Pushes.",
    "actions": ["This one goes to 11..."]
  },
  {
    "id": "7f77b684-c47a-4154-8adb-b1ee291dd177",
    "name": "Mass Energy Recharge",
    "source": "Salvage Union Workshop Manual",
    "tree": "Advanced Engineer",
    "level": 3,
    "page": 31,
    "actions": ["Mass Energy Recharge"],
    "description": "Restore 10 Energy Points to target Mechs in the field."
  },
  {
    "id": "4ddfa5ed-cae2-4870-bc21-a7860d588fd7",
    "name": "Tip Top Shape",
    "source": "Salvage Union Workshop Manual",
    "tree": "Legendary Engineer",
    "level": "L",
    "page": 31,
    "actions": ["Tip Top Shape"],
    "description": "Your Union Crawler no longer needs to pay upkeep and does not deteriorate."
  },
  {
    "id": "d2f752e1-8de5-4d4a-902d-8113106a982b",
    "name": "The Full Works",
    "source": "Salvage Union Workshop Manual",
    "tree": "Legendary Engineer",
    "level": "L",
    "page": 31,
    "actions": ["The Full Works"],
    "description": "Fully repair and restore a target Mech and all attached Systems and Modules."
  },
  {
    "id": "4cbf7319-164f-4b51-b417-1a7e8fa5d6a0",
    "name": "Hacking Kit",
    "source": "Salvage Union Workshop Manual",
    "tree": "Hacking",
    "level": 1,
    "grants": [
      {
        "name": "Hacking Kit",
        "schema": "equipment"
      }
    ],
    "page": 34,
    "actions": ["Hacking Kit"],
    "description": "Versatile tool for allowing Mech Module hacks on foot and vice-versa.",
    "additionalSources": [
      {
        "source": "Salvage Union Starter Set",
        "booklet": "PH",
        "page": 17
      }
    ]
  },
  {
    "id": "8a61839b-b0e2-4726-b436-0d76f229a9ea",
    "name": "System and Software Hacker",
    "source": "Salvage Union Workshop Manual",
    "tree": "Hacking",
    "level": 2,
    "page": 34,
    "actions": ["System and Software Hacker"],
    "description": "Attempt to destroy Systems and Modules on target Mech.",
    "additionalSources": [
      {
        "source": "Salvage Union Starter Set",
        "booklet": "PH",
        "page": 17
      }
    ]
  },
  {
    "id": "24f08353-1f4e-4549-a2e3-45272c90b57f",
    "name": "Denial of Service Attack",
    "source": "Salvage Union Workshop Manual",
    "tree": "Hacking",
    "level": 3,
    "page": 34,
    "actions": ["Denial of Service Attack"],
    "description": "Attempt to Shutdown target Mech in Range.",
    "additionalSources": [
      {
        "source": "Salvage Union Starter Set",
        "booklet": "PH",
        "page": 18
      }
    ]
  },
  {
    "id": "f7bc9f48-bdaf-4d28-a965-38b017b2328f",
    "name": "Well actually...",
    "source": "Salvage Union Workshop Manual",
    "tree": "Electronics",
    "level": 1,
    "page": 34,
    "actions": ["Well actually..."],
    "description": "Ask questions about Systems, Modules, or Technology.",
    "additionalSources": [
      {
        "source": "Salvage Union Starter Set",
        "booklet": "PH",
        "page": 18
      }
    ]
  },
  {
    "id": "f6d6d8d7-0b3e-4ea8-906f-582281a98a5e",
    "name": "Techno Babble",
    "source": "Salvage Union Workshop Manual",
    "tree": "Electronics",
    "level": 2,
    "page": 35,
    "actions": ["Techno Babble"],
    "description": "Build rapport and ask favours of other Hackers and technophiles.",
    "additionalSources": [
      {
        "source": "Salvage Union Starter Set",
        "booklet": "PH",
        "page": 18
      }
    ]
  },
  {
    "id": "3364cc4f-227f-4f88-8b73-a09309e293f0",
    "name": "Holo Companion",
    "source": "Salvage Union Workshop Manual",
    "tree": "Electronics",
    "level": 3,
    "page": 35,
    "grants": [
      {
        "name": "Holo Companion",
        "schema": "equipment"
      }
    ],
    "actions": ["Holo Companion"],
    "description": "Construct an intelligent, holographic A.I. companion, projected from a device on your person.",
    "additionalSources": [
      {
        "source": "Salvage Union Starter Set",
        "booklet": "PH",
        "page": 18
      }
    ]
  },
  {
    "id": "420ab386-ad77-4857-9679-1e4a01e3d090",
    "name": "Bionic Senses",
    "source": "Salvage Union Workshop Manual",
    "tree": "Augmentation",
    "level": 1,
    "page": 35,
    "actions": ["Bionic Senses"],
    "description": "Gain integrated Thermal Optics, Zoom Optics, or IR Night Vision Optics.",
    "additionalSources": [
      {
        "source": "Salvage Union Starter Set",
        "booklet": "PH",
        "page": 19
      }
    ]
  },
  {
    "id": "1e6183d7-0b67-40ab-91f4-134090c8846b",
    "name": "Bionic Arms",
    "source": "Salvage Union Workshop Manual",
    "tree": "Augmentation",
    "level": 2,
    "page": 35,
    "actions": ["Bionic Arms Attack", "Bionic Arms"],
    "contributions": [{"stat": "maxHp", "target": "pilot", "amount": 2}],
    "content": [
      {
        "type": "paragraph",